[
  {
    "id": "broadsword",
    "name": {
      "en-US": "Broadsword"
    },
    "type": "PRIMARY_PHYSICAL",
    "tier": 1,
    "trait": "AGILITY",
    "range": "MELEE",
    "damage": {
      "dice": "D8",
      "type": "PHYSICAL"
    },
    "burden": "ONE_HANDED",
    "features": [
      {
        "name": {
          "en-US": "Reliable"
        },
        "description": [
          {
            "type": "PARAGRAPH",
            "text": {
              "en-US": "+1 to attack rolls"
            }
          }
        ]
      }
    ]
  },
  {
    "id": "longsword",
    "name": {
      "en-US": "Longsword"
    },
    "type": "PRIMARY_PHYSICAL",
    "tier": 1,
    "trait": "AGILITY",
    "range": "MELEE",
    "damage": {
      "dice": "D8",
      "modifier": 3,
      "type": "PHYSICAL"
    },
    "burden": "TWO_HANDED"
  },
  {
    "id": "battleaxe",
    "name": {
      "en-US": "Battleaxe"
    },
    "type": "PRIMARY_PHYSICAL",
    "tier": 1,
    "trait": "STRENGTH",
    "range": "MELEE",
    "damage": {
      "dice": "D10",
      "modifier": 3,
      "type": "PHYSICAL"
    },
    "burden": "TWO_HANDED"
  },
  {
    "id": "greatsword",
    "name": {
      "en-US": "Greatsword"
    },
    "type": "PRIMARY_PHYSICAL",
    "tier": 1,
    "trait": "STRENGTH",
    "range": "MELEE",
    "damage": {
      "dice": "D10",
      "modifier": 3,
      "type": "PHYSICAL"
    },
    "burden": "TWO_HANDED",
    "features": [
      {
        "name": {
          "en-US": "Massive"
        },
        "description": [
          {
            "type": "PARAGRAPH",
            "text": {
              "en-US": "-1 to Evasion; on a successful attack, roll an additional damage die and discard the lowest result."
            }
          }
        ]
      }
    ]
  },
  {
    "id": "mace",
    "name": {
      "en-US": "Mace"
    },
    "type": "PRIMARY_PHYSICAL",
    "tier": 1,
    "trait": "STRENGTH",
    "range": "MELEE",
    "damage": {
      "dice": "D8",
      "modifier": 1,
      "type": "PHYSICAL"
    },
    "burden": "ONE_HANDED"
  },
  {
    "id": "warhammer",
    "name": {
      "en-US": "Warhammer"
    },
    "type": "PRIMARY_PHYSICAL",
    "tier": 1,
    "trait": "STRENGTH",
    "range": "MELEE",
    "damage": {
      "dice": "D12",
      "modifier": 3,
      "type": "PHYSICAL"
    },
    "burden": "TWO_HANDED",
    "features": [
      {
        "name": {
          "en-US": "Heavy"
        },
        "description": [
          {
            "type": "PARAGRAPH",
            "text": {
              "en-US": "-1 to Evasion"
            }
          }
        ]
      }
    ]
  },
  {
    "id": "dagger",
    "name": {
      "en-US": "Dagger"
    },
    "type": "PRIMARY_PHYSICAL",
    "tier": 1,
    "trait": "FINESSE",
    "range": "MELEE",
    "damage": {
      "dice": "D8",
      "modifier": 1,
      "type": "PHYSICAL"
    },
    "burden": "ONE_HANDED"
  },
  {
    "id": "quarterstaff",
    "name": {
      "en-US": "Quarterstaff"
    },
    "type": "PRIMARY_PHYSICAL",
    "tier": 1,
    "trait": "INSTINCT",
    "range": "MELEE",
    "damage": {
      "dice": "D10",
      "modifier": 3,
      "type": "PHYSICAL"
    },
    "burden": "TWO_HANDED"
  },
  {
    "id": "cutlass",
    "name": {
      "en-US": "Cutlass"
    },
    "type": "PRIMARY_PHYSICAL",
    "tier": 1,
    "trait": "PRESENCE",
    "range": "MELEE",
    "damage": {
      "dice": "D8",
      "modifier": 1,
      "type": "PHYSICAL"
    },
    "burden": "ONE_HANDED"
  },
  {
    "id": "rapier",
    "name": {
      "en-US": "Rapier"
    },
    "type": "PRIMARY_PHYSICAL",
    "tier": 1,
    "trait": "PRESENCE",
    "range": "MELEE",
    "damage": {
      "dice": "D8",
      "type": "PHYSICAL"
    },
    "burden": "ONE_HANDED",
    "features": [
      {
        "name": {
          "en-US": "Quick"
        },
        "description": [
          {
            "type": "PARAGRAPH",
            "text": {
              "en-US": "When you make an attack, you can mark a Stress to target another creature within range."
            }
          }
        ]
      }
    ]
  },
  {
    "id": "halberd",
    "name": {
      "en-US": "Halberd"
    },
    "type": "PRIMARY_PHYSICAL",
    "tier": 1,
    "trait": "STRENGTH",
    "range": "VERY_CLOSE",
    "damage": {
      "dice": "D10",
      "modifier": 2,
      "type": "PHYSICAL"
    },
    "burden": "TWO_HANDED",
    "features": [
      {
        "name": {
          "en-US": "Cumbersome"
        },
        "description": [
          {
            "type": "PARAGRAPH",
            "text": {
              "en-US": "-1 to Finesse"
            }
          }
        ]
      }
    ]
  },
  {
    "id": "spear",
    "name": {
      "en-US": "Spear"
    },
    "type": "PRIMARY_PHYSICAL",
    "tier": 1,
    "trait": "FINESSE",
    "range": "VERY_CLOSE",
    "damage": {
      "dice": "D10",
      "modifier": 2,
      "type": "PHYSICAL"
    },
    "burden": "TWO_HANDED",
    "features": [
      {
        "name": {
          "en-US": "Cumbersome"
        },
        "description": [
          {
            "type": "PARAGRAPH",
            "text": {
              "en-US": "-1 to Finesse"
            }
          }
        ]
      }
    ]
  },
  {
    "id": "shortbow",
    "name": {
      "en-US": "Shortbow"
    },
    "type": "PRIMARY_PHYSICAL",
    "tier": 1,
    "trait": "AGILITY",
    "range": "FAR",
    "damage": {
      "dice": "D6",
      "modifier": 3,
      "type": "PHYSICAL"
    },
    "burden": "TWO_HANDED"
  },
  {
    "id": "crossbow",
    "name": {
      "en-US": "Crossbow"
    },
    "type": "PRIMARY_PHYSICAL",
    "tier": 1,
    "trait": "FINESSE",
    "range": "FAR",
    "damage": {
      "dice": "D6",
      "modifier": 1,
      "type": "PHYSICAL"
    },
    "burden": "ONE_HANDED"
  },
  {
    "id": "longbow",
    "name": {
      "en-US": "Longbow"
    },
    "type": "PRIMARY_PHYSICAL",
    "tier": 1,
    "trait": "AGILITY",
    "range": "VERY_FAR",
    "damage": {
      "dice": "D8",
      "modifier": 3,
      "type": "PHYSICAL"
    },
    "burden": "TWO_HANDED",
    "features": [
      {
        "name": {
          "en-US": "Cumbersome"
        },
        "description": [
          {
            "type": "PARAGRAPH",
            "text": {
              "en-US": "-1 to Finesse"
            }
          }
        ]
      }
    ]
  },
  {
    "id": "arcane_gauntlets",
    "name": {
      "en-US": "Arcane Gauntlets"
    },
    "type": "PRIMARY_MAGIC",
    "tier": 1,
    "trait": "STRENGTH",
    "range": "MELEE",
    "damage": {
      "dice": "D10",
      "modifier": 3,
      "type": "MAGICAL"
    },
    "burden": "TWO_HANDED"
  },
  {
    "id": "hallowed_axe",
    "name": {
      "en-US": "Hallowed Axe"
    },
    "type": "PRIMARY_MAGIC",
    "tier": 1,
    "trait": "STRENGTH",
    "range": "MELEE",
    "damage": {
      "dice": "D8",
      "modifier": 1,
      "type": "MAGICAL"
    },
    "burden": "ONE_HANDED"
  },
  {
    "id": "glowing_rings",
    "name": {
      "en-US": "Glowing Rings"
    },
    "type": "PRIMARY_MAGIC",
    "tier": 1,
    "trait": "AGILITY",
    "range": "VERY_CLOSE",
    "damage": {
      "dice": "D10",
      "modifier": 1,
      "type": "MAGICAL"
    },
    "burden": "TWO_HANDED"
  },
  {
    "id": "hand_runes",
    "name": {
      "en-US": "Hand Runes"
    },
    "type": "PRIMARY_MAGIC",
    "tier": 1,
    "trait": "INSTINCT",
    "range": "VERY_CLOSE",
    "damage": {
      "dice": "D10",
      "type": "MAGICAL"
    },
    "burden": "ONE_HANDED"
  },
  {
    "id": "returning_blade",
    "name": {
      "en-US": "Returning Blade"
    },
    "type": "PRIMARY_MAGIC",
    "tier": 1,
    "trait": "FINESSE",
    "range": "CLOSE",
    "damage": {
      "dice": "D8",
      "type": "MAGICAL"
    },
    "burden": "ONE_HANDED",
    "features": [
      {
        "name": {
          "en-US": "Returning"
        },
        "description": [
          {
            "type": "PARAGRAPH",
            "text": {
              "en-US": "When this weapon is thrown within its range, it appears in your hand immediately after the attack."
            }
          }
        ]
      }
    ]
  },
  {
    "id": "shortstaff",
    "name": {
      "en-US": "Shortstaff"
    },
    "type": "PRIMARY_MAGIC",
    "tier": 1,
    "trait": "INSTINCT",
    "range": "CLOSE",
    "damage": {
      "dice": "D8",
      "modifier": 1,
      "type": "MAGICAL"
    },
    "burden": "ONE_HANDED"
  },
  {
    "id": "dualstaff",
    "name": {
      "en-US": "Dualstaff"
    },
    "type": "PRIMARY_MAGIC",
    "tier": 1,
    "trait": "INSTINCT",
    "range": "FAR",
    "damage": {
      "dice": "D6",
      "modifier": 3,
      "type": "MAGICAL"
    },
    "burden": "TWO_HANDED"
  },
  {
    "id": "scepter",
    "name": {
      "en-US": "Scepter"
    },
    "type": "PRIMARY_MAGIC",
    "tier": 1,
    "trait": "PRESENCE",
    "range": "FAR",
    "damage": {
      "dice": "D6",
      "type": "MAGICAL"
    },
    "burden": "TWO_HANDED",
    "features": [
      {
        "name": {
          "en-US": "Versatile"
        },
        "description": [
          {
            "type": "PARAGRAPH",
            "text": {
              "en-US": "This weapon can also be used with these statisticsâ€”Presence, Melee, d8."
            }
          }
        ]
      }
    ]
  },
  {
    "id": "wand",
    "name": {
      "en-US": "Wand"
    },
    "type": "PRIMARY_MAGIC",
    "tier": 1,
    "trait": "KNOWLEDGE",
    "range": "FAR",
    "damage": {
      "dice": "D6",
      "modifier": 1,
      "type": "MAGICAL"
    },
    "burden": "ONE_HANDED"
  },
  {
    "id": "greatstaff",
    "name": {
      "en-US": "Greatstaff"
    },
    "type": "PRIMARY_MAGIC",
    "tier": 1,
    "trait": "KNOWLEDGE",
    "range": "VERY_FAR",
    "damage": {
      "dice": "D6",
      "type": "MAGICAL"
    },
    "burden": "TWO_HANDED",
    "features": [
      {
        "name": {
          "en-US": "Powerful"
        },
        "description": [
          {
            "type": "PARAGRAPH",
            "text": {